{"$schema":"https://json-schema.org/draft/2020-12/schema","title":"ApprovalRecord","type":"object","required":["approval_record_id","change_request_id","decision","approver_id","approver_role","timestamp","rationale"],"properties":{"approval_record_id":{"type":"string"},"change_request_id":{"type":"string"},"decision":{"type":"string","enum":["approved","rejected","conditional"]},"approver_id":{"type":"string"},"approver_role":{"type":"string"},"timestamp":{"type":"string"},"rationale":{"type":"string"}},"additionalProperties":true}
